{
  "tieu_de": "2. BẢNG ĐẶC TẢ ĐỀ KIỂM TRA ĐỊNH KÌ",
  "thong_tin": {
    "mon": "Khoa học tự nhiên",
    "lop": 6,
    "thoi_gian": "45 phút",
    "hinh_thuc": "Trắc nghiệm khách quan kết hợp tự luận",
    "chu_de_chung": "Mở đầu về Khoa học tự nhiên – Đa dạng chất, các thể của chất"
  },
  "cau_hinh": {
    "tong_diem": 10,
    "muc_do": [
      { "ma": "NB", "ten": "Nhận biết", "ten_ngan": "Biết" },
      { "ma": "TH", "ten": "Thông hiểu", "ten_ngan": "Hiểu" },
      { "ma": "VD", "ten": "Vận dụng", "ten_ngan": "Vận dụng" },
      { "ma": "LH", "ten": "Liên hệ thực tế", "ten_ngan": "Liên hệ" }
    ],
    "ty_le_muc_tieu": { "NB": 50, "TH": 30, "VD": 10, "LH": 10 },
    "nhom_cau_hoi": [
      { "ma": "TN", "ten": "Nhiều lựa chọn", "nhom_cha": "TNKQ", "loai": 1, "diem_moi_lenh": 0.25 },
      { "ma": "DS", "ten": "\"Đúng – Sai\"", "nhom_cha": "TNKQ", "loai": 2, "diem_moi_lenh": 0.25, "so_y_moi_cau": 4 },
      { "ma": "TLN", "ten": "Trả lời ngắn", "nhom_cha": "TNKQ", "loai": 3, "diem_moi_lenh": 0.5 },
      { "ma": "TL", "ten": "Tự luận", "nhom_cha": "Tự luận", "loai": 4, "diem_moi_lenh": null, "so_y_moi_cau": 2 }
    ]
  },
  "chu_de": [
    {
      "tt": 1,
      "ten": "Mở đầu về Khoa học tự nhiên",
      "noi_dung": [
        {
          "ten": "1.1. Giới thiệu về Khoa học tự nhiên. Các lĩnh vực chủ yếu của KHTN. Vật sống – vật không sống",
          "yeu_cau_can_dat": [
            {
              "muc_do": "NB",
              "noi_dung": "– Nêu được khái niệm khoa học tự nhiên; nhận ra được đối tượng nghiên cứu của khoa học tự nhiên.",
              "so_lenh_hoi": { "TN": 1 }
            },
            {
              "muc_do": "NB",
              "noi_dung": "– Trình bày được các lĩnh vực chủ yếu của khoa học tự nhiên: Vật lí, Hoá học, Sinh học, Thiên văn học, Khoa học Trái Đất.",
              "so_lenh_hoi": { "TN": 1, "DS": 2 }
            },
            {
              "muc_do": "TH",
              "noi_dung": "– Phân biệt được vật sống và vật không sống dựa vào các đặc điểm đặc trưng (trao đổi chất, lớn lên, sinh sản, cảm ứng); phân biệt được đối tượng của KHTN với các ngành khoa học khác.",
              "so_lenh_hoi": { "TN": 1, "DS": 2 }
            }
          ]
        },
        {
          "ten": "1.2. An toàn trong phòng thực hành. Sử dụng dụng cụ đo, kính lúp và kính hiển vi quang học",
          "yeu_cau_can_dat": [
            {
              "muc_do": "NB",
              "noi_dung": "– Nêu được các quy định an toàn khi học trong phòng thực hành; nhận biết được ý nghĩa của một số kí hiệu cảnh báo.",
              "so_lenh_hoi": { "DS": 3 }
            },
            {
              "muc_do": "NB",
              "noi_dung": "– Trình bày được công dụng và cách sử dụng một số dụng cụ đo thông dụng (thước, bình chia độ, cân, nhiệt kế), kính lúp và kính hiển vi quang học.",
              "so_lenh_hoi": { "TN": 2, "TLN": 1 }
            },
            {
              "muc_do": "TH",
              "noi_dung": "– Xác định được giới hạn đo (GHĐ) và độ chia nhỏ nhất (ĐCNN) của dụng cụ đo; lựa chọn được dụng cụ đo phù hợp với phép đo.",
              "so_lenh_hoi": { "TN": 1, "DS": 1 }
            },
            {
              "muc_do": "TH",
              "noi_dung": "– Giải thích được cơ sở khoa học của một số quy tắc an toàn bắt buộc trong phòng thực hành.",
              "so_lenh_hoi": { "TL": 2 },
              "diem": { "TL": 0.5 }
            }
          ]
        }
      ]
    },
    {
      "tt": 2,
      "ten": "Đa dạng chất. Các thể của chất",
      "noi_dung": [
        {
          "ten": "2.1. Sự đa dạng của chất. Ba thể cơ bản của chất và đặc điểm",
          "yeu_cau_can_dat": [
            {
              "muc_do": "NB",
              "noi_dung": "– Nêu được sự đa dạng của chất; chất có ở xung quanh ta, trong mọi vật thể tự nhiên và vật thể nhân tạo.",
              "so_lenh_hoi": { "TN": 1, "DS": 1 }
            },
            {
              "muc_do": "NB",
              "noi_dung": "– Nêu được ba thể (trạng thái) cơ bản của chất: rắn, lỏng, khí kèm ví dụ minh hoạ ở điều kiện thường.",
              "so_lenh_hoi": { "TN": 1, "DS": 1 }
            },
            {
              "muc_do": "TH",
              "noi_dung": "– Trình bày và so sánh được đặc điểm về hình dạng, thể tích, khả năng bị nén và khả năng lan truyền của chất ở thể rắn, lỏng, khí.",
              "so_lenh_hoi": { "TN": 1, "DS": 1 }
            },
            {
              "muc_do": "VD",
              "noi_dung": "– Vận dụng đặc điểm các thể của chất để dự đoán và giải thích kết quả khi chuyển một lượng chất sang vật chứa có hình dạng khác.",
              "so_lenh_hoi": { "DS": 1, "TL": 2 },
              "diem": { "TL": 0.5 }
            }
          ]
        },
        {
          "ten": "2.2. Sự chuyển thể của chất (nóng chảy, đông đặc, hoá hơi, ngưng tụ, sôi)",
          "yeu_cau_can_dat": [
            {
              "muc_do": "NB",
              "noi_dung": "– Nêu được khái niệm về sự nóng chảy, sự đông đặc, sự bay hơi, sự ngưng tụ và sự sôi.",
              "so_lenh_hoi": { "TN": 1, "DS": 3 }
            },
            {
              "muc_do": "NB",
              "noi_dung": "– Nêu được nhiệt độ nóng chảy của nước đá và nhiệt độ sôi của nước ở điều kiện thường.",
              "so_lenh_hoi": { "TN": 1 }
            },
            {
              "muc_do": "TH",
              "noi_dung": "– Xác định được quá trình chuyển thể xảy ra trong một hiện tượng cụ thể; tính toán đơn giản với các mốc nhiệt độ chuyển thể.",
              "so_lenh_hoi": { "TN": 1, "TLN": 1 }
            },
            {
              "muc_do": "VD",
              "noi_dung": "– Vận dụng kiến thức về sự ngưng tụ để phân tích và bác bỏ một cách giải thích sai về hiện tượng thực tế.",
              "so_lenh_hoi": { "DS": 1 }
            },
            {
              "muc_do": "LH",
              "noi_dung": "– Giải thích được hiện tượng chuyển thể của nước trong đời sống (trời nồm, sương mù, giọt nước bám ngoài thành cốc) và đề xuất được biện pháp ứng phó phù hợp với gia đình, địa phương.",
              "so_lenh_hoi": { "TL": 2 },
              "diem": { "TL": 1.0 }
            }
          ]
        }
      ]
    }
  ],
  "ghi_chu": [
    "(*) Số ghi trong ô là SỐ LỆNH HỎI ứng với yêu cầu cần đạt ở dòng đó: câu loại 2 tính 4 lệnh hỏi (4 ý a, b, c, d), câu loại 4 tính 2 lệnh hỏi (2 ý a, b).",
    "(**) Bảng đặc tả đồng bộ tuyệt đối với bảng ma trận về chủ đề, đơn vị kiến thức và số lệnh hỏi từng ô."
  ]
}
